{
  "$schema": "https://civitasconnect.digital/core/artifact-envelope/v1",
  "artifactId": "urn:core:platform:civitas:element:common:3f70fe36-2a8e-861b-a0f1-ebdf67a7657f",
  "artifactType": "XSD",
  "groupId": "elements",
  "title": "AirQualityEnvelope",
  "firstVersion": {
    "version": "1.0.0",
    "content": {
      "contentType": "application/xml",
      "content": "<?xml version=\"1.0\" encoding=\"UTF-8\"?><xs:schema xmlns:xs=\"http://www.w3.org/2001/XMLSchema\" targetNamespace=\"https://example.test/air-quality-envelope\" xmlns=\"https://example.test/air-quality-envelope\" elementFormDefault=\"qualified\"><xs:complexType name=\"AirQualityEnvelopeMeasurement\"><xs:sequence><xs:element name=\"stationId\" type=\"xs:string\"/><xs:element name=\"pm25\" type=\"xs:decimal\"/><xs:element name=\"measuredAt\" type=\"xs:dateTime\"/></xs:sequence></xs:complexType><xs:element name=\"measurement\" type=\"AirQualityEnvelopeMeasurement\"/></xs:schema>"
    }
  }
}
